{
  "schemaVersion": "ai-capex-foundation-v0.1",
  "researchOnly": true,
  "reviewedOn": "2026-10-06",
  "coveragePolicy": "Sparse manually reviewed qualification anchors; not continuous quarterly history.",
  "interpretationGuardrail": "Company economics, AI attribution and model assumptions remain separate. No identifiable AI investment return is asserted.",
  "sources": [
    {
      "sourceId": "ms26",
      "company": "MSFT",
      "publisher": "Microsoft",
      "title": "FY2026 Q4 earnings release",
      "sourceDate": "2026-07-29",
      "sourceDatePrecision": "DATE",
      "url": "https://www.microsoft.com/en-us/investor/earnings/fy-2026-q4/press-release-webcast",
      "retrievedOn": "2026-10-06",
      "verificationMethod": "MANUAL_OFFICIAL_PAGE_REVIEW",
      "rawSha256": null,
      "locator": "Income statements; cash flows; segment revenue and operating income",
      "identityLimitation": "Official page and table manually reviewed; raw source bytes are not committed or archived by this fixture. No historical real-time availability claim."
    },
    {
      "sourceId": "mscall26",
      "company": "MSFT",
      "publisher": "Microsoft",
      "title": "FY2026 Q4 earnings call",
      "sourceDate": "2026-07-29",
      "sourceDatePrecision": "DATE",
      "url": "https://www.microsoft.com/en-us/investor/events/fy-2026/earnings-fy-2026-q4",
      "retrievedOn": "2026-10-06",
      "verificationMethod": "MANUAL_OFFICIAL_PAGE_REVIEW",
      "rawSha256": null,
      "locator": "CFO prepared remarks: capital expenditures, cash flow, Microsoft Cloud and outlook",
      "identityLimitation": "Official page and table manually reviewed; raw source bytes are not committed or archived by this fixture. No historical real-time availability claim."
    },
    {
      "sourceId": "msai26",
      "company": "MSFT",
      "publisher": "Microsoft",
      "title": "FY2026 Q3 earnings release",
      "sourceDate": "2026-04-29",
      "sourceDatePrecision": "DATE",
      "url": "https://www.microsoft.com/en-us/investor/earnings/fy-2026-q3/press-release-webcast",
      "retrievedOn": "2026-10-06",
      "verificationMethod": "MANUAL_OFFICIAL_PAGE_REVIEW",
      "rawSha256": null,
      "locator": "CEO statement: AI annual revenue run rate",
      "identityLimitation": "Official page and table manually reviewed; raw source bytes are not committed or archived by this fixture. No historical real-time availability claim."
    },
    {
      "sourceId": "goog26",
      "company": "GOOG",
      "publisher": "Alphabet",
      "title": "Q2 2026 earnings release, Exhibit 99.1",
      "sourceDate": "2026-07-22",
      "sourceDatePrecision": "DATE",
      "url": "https://www.sec.gov/Archives/edgar/data/1652044/000165204426000066/googexhibit991q22026.htm",
      "retrievedOn": "2026-10-06",
      "verificationMethod": "MANUAL_OFFICIAL_PAGE_REVIEW",
      "rawSha256": null,
      "locator": "Consolidated income/cash flow statements; segment results; non-GAAP FCF reconciliation",
      "identityLimitation": "Official page and table manually reviewed; raw source bytes are not committed or archived by this fixture. No historical real-time availability claim."
    },
    {
      "sourceId": "googq26",
      "company": "GOOG",
      "publisher": "Alphabet",
      "title": "Q2 2026 Form 10-Q",
      "sourceDate": "2026-07-23",
      "sourceDatePrecision": "DATE",
      "url": "https://www.sec.gov/Archives/edgar/data/1652044/000165204426000071/goog-20260630.htm",
      "retrievedOn": "2026-10-06",
      "verificationMethod": "MANUAL_OFFICIAL_PAGE_REVIEW",
      "rawSha256": null,
      "locator": "Note 2: remaining performance obligations and inclusion of short-term contracts",
      "identityLimitation": "Official page and table manually reviewed; raw source bytes are not committed or archived by this fixture. No historical real-time availability claim."
    },
    {
      "sourceId": "amzn26",
      "company": "AMZN",
      "publisher": "Amazon",
      "title": "Q2 2026 earnings release",
      "sourceDate": "2026-07-30",
      "sourceDatePrecision": "DATE",
      "url": "https://ir.aboutamazon.com/news-release/news-release-details/2026/Amazon-com-Announces-Second-Quarter-Results/default.aspx",
      "retrievedOn": "2026-10-06",
      "verificationMethod": "MANUAL_OFFICIAL_PAGE_REVIEW",
      "rawSha256": null,
      "locator": "CEO statement; cash flow statements; segment results; supplemental FCF definition",
      "identityLimitation": "Official page and table manually reviewed; raw source bytes are not committed or archived by this fixture. No historical real-time availability claim."
    },
    {
      "sourceId": "amznq26",
      "company": "AMZN",
      "publisher": "Amazon",
      "title": "Q2 2026 Form 10-Q",
      "sourceDate": "2026-07-31",
      "sourceDatePrecision": "DATE",
      "url": "https://www.sec.gov/Archives/edgar/data/1018724/000101872426000026/amzn-20260630.htm",
      "retrievedOn": "2026-10-06",
      "verificationMethod": "MANUAL_OFFICIAL_PAGE_REVIEW",
      "rawSha256": null,
      "locator": "Segment information: PP&E additions and PP&E depreciation/amortization",
      "identityLimitation": "Official page and table manually reviewed; raw source bytes are not committed or archived by this fixture. No historical real-time availability claim."
    },
    {
      "sourceId": "meta26",
      "company": "META",
      "publisher": "Meta Platforms",
      "title": "Q2 2026 earnings release",
      "sourceDate": "2026-07-29",
      "sourceDatePrecision": "DATE",
      "url": "https://investor.atmeta.com/investor-news/press-release-details/2026/Meta-Reports-Second-Quarter-2026-Results/",
      "retrievedOn": "2026-10-06",
      "verificationMethod": "MANUAL_OFFICIAL_PAGE_REVIEW",
      "rawSha256": null,
      "locator": "Consolidated financial statements; FCF reconciliation; operating highlights; outlook",
      "identityLimitation": "Official page and table manually reviewed; raw source bytes are not committed or archived by this fixture. No historical real-time availability claim."
    },
    {
      "sourceId": "metaq26",
      "company": "META",
      "publisher": "Meta Platforms",
      "title": "Q2 2026 Form 10-Q",
      "sourceDate": "2026-07-30",
      "sourceDatePrecision": "DATE",
      "url": "https://www.sec.gov/Archives/edgar/data/1326801/000162828026050705/meta-20260630.htm",
      "retrievedOn": "2026-10-06",
      "verificationMethod": "MANUAL_OFFICIAL_PAGE_REVIEW",
      "rawSha256": null,
      "locator": "Note 6: property and equipment",
      "identityLimitation": "Official page and table manually reviewed; raw source bytes are not committed or archived by this fixture. No historical real-time availability claim."
    },
    {
      "sourceId": "ms19",
      "company": "MSFT",
      "publisher": "Microsoft",
      "title": "FY2019 Q4 earnings release",
      "sourceDate": "2019-07-18",
      "sourceDatePrecision": "DATE",
      "url": "https://www.microsoft.com/en-us/investor/earnings/fy-2019-q4/press-release-webcast",
      "retrievedOn": "2026-10-06",
      "verificationMethod": "MANUAL_OFFICIAL_PAGE_REVIEW",
      "rawSha256": null,
      "locator": "Quarter ended June 30 2019 column, income and cash flow statements",
      "identityLimitation": "Official page and table manually reviewed; raw source bytes are not committed or archived by this fixture. No historical real-time availability claim."
    },
    {
      "sourceId": "goog19",
      "company": "GOOG",
      "publisher": "Alphabet",
      "title": "Q2 2020 Form 10-Q, 2019 comparative columns",
      "sourceDate": "2020-07-31",
      "sourceDatePrecision": "DATE",
      "url": "https://www.sec.gov/Archives/edgar/data/1652044/000165204420000032/goog-20200630.htm",
      "retrievedOn": "2026-10-06",
      "verificationMethod": "MANUAL_OFFICIAL_PAGE_REVIEW",
      "rawSha256": null,
      "locator": "2019 comparative columns: quarterly income; six-month cash flows",
      "identityLimitation": "Official page and table manually reviewed; raw source bytes are not committed or archived by this fixture. No historical real-time availability claim."
    },
    {
      "sourceId": "amzn19",
      "company": "AMZN",
      "publisher": "Amazon",
      "title": "Q2 2020 earnings release, 2019 comparative columns",
      "sourceDate": "2020-07-30",
      "sourceDatePrecision": "DATE",
      "url": "https://ir.aboutamazon.com/news-release/news-release-details/2020/Amazon.com-Announces-Second-Quarter-Results/default.aspx",
      "retrievedOn": "2026-10-06",
      "verificationMethod": "MANUAL_OFFICIAL_PAGE_REVIEW",
      "rawSha256": null,
      "locator": "Three months ended June 30 2019 column: cash flow statement",
      "identityLimitation": "Official page and table manually reviewed; raw source bytes are not committed or archived by this fixture. No historical real-time availability claim."
    },
    {
      "sourceId": "meta19",
      "company": "META",
      "publisher": "Facebook (now Meta Platforms)",
      "title": "Q2 2019 earnings release",
      "sourceDate": "2019-07-24",
      "sourceDatePrecision": "DATE",
      "url": "https://investor.atmeta.com/investor-news/press-release-details/2019/Facebook-Reports-Second-Quarter-2019-Results/default.aspx",
      "retrievedOn": "2026-10-06",
      "verificationMethod": "MANUAL_OFFICIAL_PAGE_REVIEW",
      "rawSha256": null,
      "locator": "Quarter ended June 30 2019 column: statements and FCF reconciliation",
      "identityLimitation": "Official page and table manually reviewed; raw source bytes are not committed or archived by this fixture. No historical real-time availability claim."
    }
  ],
  "observations": [
    {
      "observationId": "ms26:revenue:CONSOLIDATED:Q:2026-06-30",
      "company": "MSFT",
      "metric": "revenue",
      "domain": "financials",
      "value": 90007,
      "unit": "USD_MILLIONS",
      "fiscalQuarter": "FY2026Q4",
      "calendarQuarter": "2026Q2",